[I 2025-05-09 13:07:05,111] Trial 34 finished with value: 0.05988350346720657 and parameters: {'bagging_temperature': 0.4171359190157786, 'depth': 7, 'feature_border_type': 'MinEntropy', 'grow_policy': 'Depthwise', 'l2_leaf_reg': 6.106525246461352, 'leaf_estimation_iterations': 2, 'learning_rate': 0.011921641843414368, 'min_child_samples': 7, 'random_strength': 4}. Best is trial 14 with value: 0.0598598500699203.
score=0.05988, best_iterations=[1404, 1369, 1322, 1446, 1426], params_gbdt={'bagging_temperature': 0.41909341288208113, 'depth': 8, 'feature_border_type': 'MinEntropy', 'grow_policy': 'Depthwise', 'l2_leaf_reg': 5.801568326401112, 'leaf_estimation_iterations': 2, 'learning_rate': 0.011915301462835494, 'min_child_samples': 8, 'random_strength': 5}, duration=125.07
[I 2025-05-09 13:09:10,253] Trial 35 finished with value: 0.05987862523165469 and parameters: {'bagging_temperature': 0.41909341288208113, 'depth': 8, 'feature_border_type': 'MinEntropy', 'grow_policy': 'Depthwise', 'l2_leaf_reg': 5.801568326401112, 'leaf_estimation_iterations': 2, 'learning_rate': 0.011915301462835494, 'min_child_samples': 8, 'random_strength': 5}. Best is trial 14 with value: 0.0598598500699203.
score=0.05996, best_iterations=[5999, 4570, 4915, 4972, 4550], params_gbdt={'bagging_temperature': 0.4151125371288323, 'depth': 8, 'feature_border_type': 'MinEntropy', 'grow_policy': 'Lossguide', 'l2_leaf_reg': 5.8828486416964845, 'leaf_estimation_iterations': 2, 'learning_rate': 0.01104524195316125, 'min_child_samples': 8, 'random_strength': 4}, duration=296.98
[I 2025-05-09 13:14:07,341] Trial 36 finished with value: 0.05996327433993698 and parameters: {'bagging_temperature': 0.4151125371288323, 'depth': 8, 'feature_border_type': 'MinEntropy', 'grow_policy': 'Lossguide', 'l2_leaf_reg': 5.8828486416964845, 'leaf_estimation_iterations': 2, 'learning_rate': 0.01104524195316125, 'min_child_samples': 8, 'random_strength': 4}. Best is trial 14 with value: 0.0598598500699203.
score=0.06005, best_iterations=[1366, 1103, 988, 1162, 1042], params_gbdt={'bagging_temperature': 0.4198245647886868, 'depth': 9, 'feature_border_type': 'MinEntropy', 'grow_policy': 'Depthwise', 'l2_leaf_reg': 0.8463600056651859, 'leaf_estimation_iterations': 2, 'learning_rate': 0.008898613420802172, 'min_child_samples': 8, 'random_strength': 6}, duration=148.50
[I 2025-05-09 13:16:35,893] Trial 37 finished with value: 0.06004643522001349 and parameters: {'bagging_temperature': 0.4198245647886868, 'depth': 9, 'feature_border_type': 'MinEntropy', 'grow_policy': 'Depthwise', 'l2_leaf_reg': 0.8463600056651859, 'leaf_estimation_iterations': 2, 'learning_rate': 0.008898613420802172, 'min_child_samples': 8, 'random_strength': 6}. Best is trial 14 with value: 0.0598598500699203.
score=0.06008, best_iterations=[3031, 2616, 2160, 3076, 2077], params_gbdt={'bagging_temperature': 0.47106753711998084, 'depth': 8, 'feature_border_type': 'MinEntropy', 'grow_policy': 'Lossguide', 'l2_leaf_reg': 5.297251299547492, 'leaf_estimation_iterations': 6, 'learning_rate': 0.019580366430346077, 'min_child_samples': 3, 'random_strength': 3}, duration=201.58
[I 2025-05-09 13:19:57,521] Trial 38 finished with value: 0.060084982391164596 and parameters: {'bagging_temperature': 0.47106753711998084, 'depth': 8, 'feature_border_type': 'MinEntropy', 'grow_policy': 'Lossguide', 'l2_leaf_reg': 5.297251299547492, 'leaf_estimation_iterations': 6, 'learning_rate': 0.019580366430346077, 'min_child_samples': 3, 'random_strength': 3}. Best is trial 14 with value: 0.0598598500699203.
score=0.05999, best_iterations=[1416, 1327, 700, 1095, 1190], params_gbdt={'bagging_temperature': 0.19979520606608575, 'depth': 8, 'feature_border_type': 'MinEntropy', 'grow_policy': 'Depthwise', 'l2_leaf_reg': 2.835220956998409, 'leaf_estimation_iterations': 4, 'learning_rate': 0.01202662832780995, 'min_child_samples': 9, 'random_strength': 6}, duration=125.76
[I 2025-05-09 13:22:03,340] Trial 39 finished with value: 0.05999321972028983 and parameters: {'bagging_temperature': 0.19979520606608575, 'depth': 8, 'feature_border_type': 'MinEntropy', 'grow_policy': 'Depthwise', 'l2_leaf_reg': 2.835220956998409, 'leaf_estimation_iterations': 4, 'learning_rate': 0.01202662832780995, 'min_child_samples': 9, 'random_strength': 6}. Best is trial 14 with value: 0.0598598500699203.
score=0.06021, best_iterations=[3491, 5157, 3245, 3321, 2389], params_gbdt={'bagging_temperature': 0.3782452859289061, 'depth': 4, 'feature_border_type': 'MinEntropy', 'grow_policy': 'Depthwise', 'l2_leaf_reg': 1.181794405909457, 'leaf_estimation_iterations': 2, 'learning_rate': 0.023453857768227213, 'min_child_samples': 7, 'random_strength': 7}, duration=133.35
[I 2025-05-09 13:24:16,733] Trial 40 finished with value: 0.060212234611133356 and parameters: {'bagging_temperature': 0.3782452859289061, 'depth': 4, 'feature_border_type': 'MinEntropy', 'grow_policy': 'Depthwise', 'l2_leaf_reg': 1.181794405909457, 'leaf_estimation_iterations': 2, 'learning_rate': 0.023453857768227213, 'min_child_samples': 7, 'random_strength': 7}. Best is trial 14 with value: 0.0598598500699203.
score=0.06030, best_iterations=[93, 86, 91, 113, 109], params_gbdt={'bagging_temperature': 0.476570447194581, 'depth': 9, 'feature_border_type': 'MinEntropy', 'grow_policy': 'Depthwise', 'l2_leaf_reg': 4.435314577258781, 'leaf_estimation_iterations': 6, 'learning_rate': 0.0917033903668721, 'min_child_samples': 5, 'random_strength': 1}, duration=44.35
[I 2025-05-09 13:25:01,178] Trial 41 finished with value: 0.06029789545995281 and parameters: {'bagging_temperature': 0.476570447194581, 'depth': 9, 'feature_border_type': 'MinEntropy', 'grow_policy': 'Depthwise', 'l2_leaf_reg': 4.435314577258781, 'leaf_estimation_iterations': 6, 'learning_rate': 0.0917033903668721, 'min_child_samples': 5, 'random_strength': 1}. Best is trial 14 with value: 0.0598598500699203.
score=0.06017, best_iterations=[5999, 5999, 5998, 5998, 5986], params_gbdt={'bagging_temperature': 0.26279657310297433, 'depth': 6, 'feature_border_type': 'Uniform', 'grow_policy': 'Lossguide', 'l2_leaf_reg': 7.0826052583309576, 'leaf_estimation_iterations': 4, 'learning_rate': 0.007391616859922883, 'min_child_samples': 7, 'random_strength': 5}, duration=359.20
[I 2025-05-09 13:31:00,485] Trial 42 finished with value: 0.060169791972899955 and parameters: {'bagging_temperature': 0.26279657310297433, 'depth': 6, 'feature_border_type': 'Uniform', 'grow_policy': 'Lossguide', 'l2_leaf_reg': 7.0826052583309576, 'leaf_estimation_iterations': 4, 'learning_rate': 0.007391616859922883, 'min_child_samples': 7, 'random_strength': 5}. Best is trial 14 with value: 0.0598598500699203.
score=0.05987, best_iterations=[1944, 3268, 1996, 3240, 1992], params_gbdt={'bagging_temperature': 0.35486066884835504, 'depth': 7, 'feature_border_type': 'MaxLogSum', 'grow_policy': 'Depthwise', 'l2_leaf_reg': 9.525821937353918, 'leaf_estimation_iterations': 2, 'learning_rate': 0.01202194160362345, 'min_child_samples': 7, 'random_strength': 3}, duration=152.55
[I 2025-05-09 13:33:33,077] Trial 43 finished with value: 0.059865129253720964 and parameters: {'bagging_temperature': 0.35486066884835504, 'depth': 7, 'feature_border_type': 'MaxLogSum', 'grow_policy': 'Depthwise', 'l2_leaf_reg': 9.525821937353918, 'leaf_estimation_iterations': 2, 'learning_rate': 0.01202194160362345, 'min_child_samples': 7, 'random_strength': 3}. Best is trial 14 with value: 0.0598598500699203.
score=0.05986, best_iterations=[2291, 3541, 2853, 3323, 1988], params_gbdt={'bagging_temperature': 0.35835114971286197, 'depth': 7, 'feature_border_type': 'MaxLogSum', 'grow_policy': 'Depthwise', 'l2_leaf_reg': 6.397860495326094, 'leaf_estimation_iterations': 2, 'learning_rate': 0.010279852356121473, 'min_child_samples': 8, 'random_strength': 3}, duration=172.48
[I 2025-05-09 13:36:25,631] Trial 44 finished with value: 0.059864927338505146 and parameters: {'bagging_temperature': 0.35835114971286197, 'depth': 7, 'feature_border_type': 'MaxLogSum', 'grow_policy': 'Depthwise', 'l2_leaf_reg': 6.397860495326094, 'leaf_estimation_iterations': 2, 'learning_rate': 0.010279852356121473, 'min_child_samples': 8, 'random_strength': 3}. Best is trial 14 with value: 0.0598598500699203.
score=0.06003, best_iterations=[1518, 1552, 903, 1419, 1329], params_gbdt={'bagging_temperature': 0.363620179170492, 'depth': 8, 'feature_border_type': 'MaxLogSum', 'grow_policy': 'Depthwise', 'l2_leaf_reg': 0.011062661827757485, 'leaf_estimation_iterations': 1, 'learning_rate': 0.009388492460766212, 'min_child_samples': 8, 'random_strength': 3}, duration=112.42
[I 2025-05-09 13:38:18,091] Trial 45 finished with value: 0.06003396646993183 and parameters: {'bagging_temperature': 0.363620179170492, 'depth': 8, 'feature_border_type': 'MaxLogSum', 'grow_policy': 'Depthwise', 'l2_leaf_reg': 0.011062661827757485, 'leaf_estimation_iterations': 1, 'learning_rate': 0.009388492460766212, 'min_child_samples': 8, 'random_strength': 3}. Best is trial 14 with value: 0.0598598500699203.
score=0.06009, best_iterations=[5999, 5999, 5999, 5999, 5254], params_gbdt={'bagging_temperature': 0.10874740158489804, 'depth': 6, 'feature_border_type': 'MaxLogSum', 'grow_policy': 'Depthwise', 'l2_leaf_reg': 2.492675216536504, 'leaf_estimation_iterations': 2, 'learning_rate': 0.005351209469993327, 'min_child_samples': 9, 'random_strength': 2}, duration=271.91
[I 2025-05-09 13:42:50,077] Trial 46 finished with value: 0.06008776806513109 and parameters: {'bagging_temperature': 0.10874740158489804, 'depth': 6, 'feature_border_type': 'MaxLogSum', 'grow_policy': 'Depthwise', 'l2_leaf_reg': 2.492675216536504, 'leaf_estimation_iterations': 2, 'learning_rate': 0.005351209469993327, 'min_child_samples': 9, 'random_strength': 2}. Best is trial 14 with value: 0.0598598500699203.
score=0.06001, best_iterations=[884, 835, 500, 974, 808], params_gbdt={'bagging_temperature': 0.3010508299453293, 'depth': 8, 'feature_border_type': 'MaxLogSum', 'grow_policy': 'Depthwise', 'l2_leaf_reg': 7.0535702688617326, 'leaf_estimation_iterations': 5, 'learning_rate': 0.01754551392409373, 'min_child_samples': 8, 'random_strength': 5}, duration=101.17
[I 2025-05-09 13:44:31,320] Trial 47 finished with value: 0.06000621894357194 and parameters: {'bagging_temperature': 0.3010508299453293, 'depth': 8, 'feature_border_type': 'MaxLogSum', 'grow_policy': 'Depthwise', 'l2_leaf_reg': 7.0535702688617326, 'leaf_estimation_iterations': 5, 'learning_rate': 0.01754551392409373, 'min_child_samples': 8, 'random_strength': 5}. Best is trial 14 with value: 0.0598598500699203.
score=0.05989, best_iterations=[1748, 2053, 1624, 2001, 1819], params_gbdt={'bagging_temperature': 0.21803689024365513, 'depth': 7, 'feature_border_type': 'MaxLogSum', 'grow_policy': 'Depthwise', 'l2_leaf_reg': 9.761319997199294, 'leaf_estimation_iterations': 4, 'learning_rate': 0.013856911197605487, 'min_child_samples': 6, 'random_strength': 3}, duration=139.01
[I 2025-05-09 13:46:50,400] Trial 48 finished with value: 0.05989471592046582 and parameters: {'bagging_temperature': 0.21803689024365513, 'depth': 7, 'feature_border_type': 'MaxLogSum', 'grow_policy': 'Depthwise', 'l2_leaf_reg': 9.761319997199294, 'leaf_estimation_iterations': 4, 'learning_rate': 0.013856911197605487, 'min_child_samples': 6, 'random_strength': 3}. Best is trial 14 with value: 0.0598598500699203.
score=0.05990, best_iterations=[2847, 4076, 3142, 3342, 2643], params_gbdt={'bagging_temperature': 0.43419610992662167, 'depth': 7, 'feature_border_type': 'Median', 'grow_policy': 'Depthwise', 'l2_leaf_reg': 3.6207642491362515, 'leaf_estimation_iterations': 1, 'learning_rate': 0.010405712775536313, 'min_child_samples': 10, 'random_strength': 7}, duration=170.07
[I 2025-05-09 13:49:40,514] Trial 49 finished with value: 0.05989517367480379 and parameters: {'bagging_temperature': 0.43419610992662167, 'depth': 7, 'feature_border_type': 'Median', 'grow_policy': 'Depthwise', 'l2_leaf_reg': 3.6207642491362515, 'leaf_estimation_iterations': 1, 'learning_rate': 0.010405712775536313, 'min_child_samples': 10, 'random_strength': 7}. Best is trial 14 with value: 0.0598598500699203.
score=0.06006, best_iterations=[4621, 5918, 5092, 5923, 3736], params_gbdt={'bagging_temperature': 0.3593970049499766, 'depth': 6, 'feature_border_type': 'MaxLogSum', 'grow_policy': 'Depthwise', 'l2_leaf_reg': 1.6682845021496724, 'leaf_estimation_iterations': 15, 'learning_rate': 0.007033065835648191, 'min_child_samples': 8, 'random_strength': 6}, duration=432.42
[I 2025-05-09 13:56:52,983] Trial 50 finished with value: 0.06006457472070185 and parameters: {'bagging_temperature': 0.3593970049499766, 'depth': 6, 'feature_border_type': 'MaxLogSum', 'grow_policy': 'Depthwise', 'l2_leaf_reg': 1.6682845021496724, 'leaf_estimation_iterations': 15, 'learning_rate': 0.007033065835648191, 'min_child_samples': 8, 'random_strength': 6}. Best is trial 14 with value: 0.0598598500699203.
score=0.06017, best_iterations=[208, 209, 241, 262, 218], params_gbdt={'bagging_temperature': 0.5116657262697528, 'depth': 10, 'feature_border_type': 'MaxLogSum', 'grow_policy': 'Depthwise', 'l2_leaf_reg': 7.050974716105889, 'leaf_estimation_iterations': 7, 'learning_rate': 0.03601600601572194, 'min_child_samples': 7, 'random_strength': 8}, duration=83.05
[I 2025-05-09 13:58:16,080] Trial 51 finished with value: 0.06016635845151174 and parameters: {'bagging_temperature': 0.5116657262697528, 'depth': 10, 'feature_border_type': 'MaxLogSum', 'grow_policy': 'Depthwise', 'l2_leaf_reg': 7.050974716105889, 'leaf_estimation_iterations': 7, 'learning_rate': 0.03601600601572194, 'min_child_samples': 7, 'random_strength': 8}. Best is trial 14 with value: 0.0598598500699203.
score=0.05997, best_iterations=[927, 1337, 1320, 1509, 1165], params_gbdt={'bagging_temperature': 0.3051422114121314, 'depth': 8, 'feature_border_type': 'Uniform', 'grow_policy': 'Depthwise', 'l2_leaf_reg': 4.009701098133223, 'leaf_estimation_iterations': 3, 'learning_rate': 0.013559635632450403, 'min_child_samples': 9, 'random_strength': 5}, duration=122.88
[I 2025-05-09 14:00:18,995] Trial 52 finished with value: 0.059973769516520004 and parameters: {'bagging_temperature': 0.3051422114121314, 'depth': 8, 'feature_border_type': 'Uniform', 'grow_policy': 'Depthwise', 'l2_leaf_reg': 4.009701098133223, 'leaf_estimation_iterations': 3, 'learning_rate': 0.013559635632450403, 'min_child_samples': 9, 'random_strength': 5}. Best is trial 14 with value: 0.0598598500699203.
score=0.05989, best_iterations=[2450, 2693, 1690, 1931, 1739], params_gbdt={'bagging_temperature': 0.45550914937023085, 'depth': 7, 'feature_border_type': 'MinEntropy', 'grow_policy': 'Depthwise', 'l2_leaf_reg': 6.664076186807912, 'leaf_estimation_iterations': 2, 'learning_rate': 0.012924652354487587, 'min_child_samples': 7, 'random_strength': 4}, duration=136.51
[I 2025-05-09 14:02:35,562] Trial 53 finished with value: 0.05988986458683161 and parameters: {'bagging_temperature': 0.45550914937023085, 'depth': 7, 'feature_border_type': 'MinEntropy', 'grow_policy': 'Depthwise', 'l2_leaf_reg': 6.664076186807912, 'leaf_estimation_iterations': 2, 'learning_rate': 0.012924652354487587, 'min_child_samples': 7, 'random_strength': 4}. Best is trial 14 with value: 0.0598598500699203.
score=0.05989, best_iterations=[2413, 3045, 2361, 3074, 2004], params_gbdt={'bagging_temperature': 0.37184317872951467, 'depth': 7, 'feature_border_type': 'GreedyLogSum', 'grow_policy': 'Depthwise', 'l2_leaf_reg': 5.354374047302739, 'leaf_estimation_iterations': 2, 'learning_rate': 0.010407455975344187, 'min_child_samples': 7, 'random_strength': 3}, duration=158.48
[I 2025-05-09 14:05:14,124] Trial 54 finished with value: 0.059893042656094714 and parameters: {'bagging_temperature': 0.37184317872951467, 'depth': 7, 'feature_border_type': 'GreedyLogSum', 'grow_policy': 'Depthwise', 'l2_leaf_reg': 5.354374047302739, 'leaf_estimation_iterations': 2, 'learning_rate': 0.010407455975344187, 'min_child_samples': 7, 'random_strength': 3}. Best is trial 14 with value: 0.0598598500699203.
score=0.05982, best_iterations=[1039, 1092, 1113, 1286, 827], params_gbdt={'bagging_temperature': 0.3974158898852442, 'depth': 8, 'feature_border_type': 'MaxLogSum', 'grow_policy': 'Depthwise', 'l2_leaf_reg': 9.679893970101352, 'leaf_estimation_iterations': 1, 'learning_rate': 0.029674463973567017, 'min_child_samples': 6, 'random_strength': 2}, duration=84.26
[I 2025-05-09 14:06:38,455] Trial 55 finished with value: 0.059823454946499696 and parameters: {'bagging_temperature': 0.3974158898852442, 'depth': 8, 'feature_border_type': 'MaxLogSum', 'grow_policy': 'Depthwise', 'l2_leaf_reg': 9.679893970101352, 'leaf_estimation_iterations': 1, 'learning_rate': 0.029674463973567017, 'min_child_samples': 6, 'random_strength': 2}. Best is trial 55 with value: 0.059823454946499696.
score=0.05986, best_iterations=[543, 826, 794, 848, 684], params_gbdt={'bagging_temperature': 0.2494330025641699, 'depth': 9, 'feature_border_type': 'MaxLogSum', 'grow_policy': 'Depthwise', 'l2_leaf_reg': 9.138174898501067, 'leaf_estimation_iterations': 1, 'learning_rate': 0.029797721849157303, 'min_child_samples': 5, 'random_strength': 1}, duration=83.68
[I 2025-05-09 14:08:02,175] Trial 56 finished with value: 0.059857954788879245 and parameters: {'bagging_temperature': 0.2494330025641699, 'depth': 9, 'feature_border_type': 'MaxLogSum', 'grow_policy': 'Depthwise', 'l2_leaf_reg': 9.138174898501067, 'leaf_estimation_iterations': 1, 'learning_rate': 0.029797721849157303, 'min_child_samples': 5, 'random_strength': 1}. Best is trial 55 with value: 0.059823454946499696.
score=0.05993, best_iterations=[367, 636, 429, 704, 270], params_gbdt={'bagging_temperature': 0.15497545353954398, 'depth': 9, 'feature_border_type': 'MaxLogSum', 'grow_policy': 'Depthwise', 'l2_leaf_reg': 8.65977458243274, 'leaf_estimation_iterations': 1, 'learning_rate': 0.04450516840012566, 'min_child_samples': 5, 'random_strength': 1}, duration=65.09
[I 2025-05-09 14:09:07,336] Trial 57 finished with value: 0.05992944637016795 and parameters: {'bagging_temperature': 0.15497545353954398, 'depth': 9, 'feature_border_type': 'MaxLogSum', 'grow_policy': 'Depthwise', 'l2_leaf_reg': 8.65977458243274, 'leaf_estimation_iterations': 1, 'learning_rate': 0.04450516840012566, 'min_child_samples': 5, 'random_strength': 1}. Best is trial 55 with value: 0.059823454946499696.
score=0.06003, best_iterations=[355, 293, 307, 412, 300], params_gbdt={'bagging_temperature': 0.2516158063309531, 'depth': 9, 'feature_border_type': 'MaxLogSum', 'grow_policy': 'Depthwise', 'l2_leaf_reg': 9.37062153285663, 'leaf_estimation_iterations': 4, 'learning_rate': 0.031453023817686124, 'min_child_samples': 4, 'random_strength': 1}, duration=71.45
[I 2025-05-09 14:10:18,865] Trial 58 finished with value: 0.060025651314000505 and parameters: {'bagging_temperature': 0.2516158063309531, 'depth': 9, 'feature_border_type': 'MaxLogSum', 'grow_policy': 'Depthwise', 'l2_leaf_reg': 9.37062153285663, 'leaf_estimation_iterations': 4, 'learning_rate': 0.031453023817686124, 'min_child_samples': 4, 'random_strength': 1}. Best is trial 55 with value: 0.059823454946499696.
score=0.06007, best_iterations=[279, 174, 170, 257, 196], params_gbdt={'bagging_temperature': 0.23757090453062069, 'depth': 10, 'feature_border_type': 'MaxLogSum', 'grow_policy': 'Depthwise', 'l2_leaf_reg': 3.103591803094631, 'leaf_estimation_iterations': 1, 'learning_rate': 0.0547952419073842, 'min_child_samples': 6, 'random_strength': 3}, duration=53.94
[I 2025-05-09 14:11:12,847] Trial 59 finished with value: 0.06006857167679113 and parameters: {'bagging_temperature': 0.23757090453062069, 'depth': 10, 'feature_border_type': 'MaxLogSum', 'grow_policy': 'Depthwise', 'l2_leaf_reg': 3.103591803094631, 'leaf_estimation_iterations': 1, 'learning_rate': 0.0547952419073842, 'min_child_samples': 6, 'random_strength': 3}. Best is trial 55 with value: 0.059823454946499696.
score=0.06002, best_iterations=[591, 521, 530, 622, 521], params_gbdt={'bagging_temperature': 0.9386337008822138, 'depth': 9, 'feature_border_type': 'MaxLogSum', 'grow_policy': 'Depthwise', 'l2_leaf_reg': 0.04300892014805388, 'leaf_estimation_iterations': 3, 'learning_rate': 0.01676237095734698, 'min_child_samples': 5, 'random_strength': 2}, duration=94.00
[I 2025-05-09 14:12:46,914] Trial 60 finished with value: 0.060024541990985406 and parameters: {'bagging_temperature': 0.9386337008822138, 'depth': 9, 'feature_border_type': 'MaxLogSum', 'grow_policy': 'Depthwise', 'l2_leaf_reg': 0.04300892014805388, 'leaf_estimation_iterations': 3, 'learning_rate': 0.01676237095734698, 'min_child_samples': 5, 'random_strength': 2}. Best is trial 55 with value: 0.059823454946499696.
score=0.06004, best_iterations=[609, 496, 304, 613, 519], params_gbdt={'bagging_temperature': 0.3256431938214889, 'depth': 8, 'feature_border_type': 'MaxLogSum', 'grow_policy': 'Depthwise', 'l2_leaf_reg': 7.815714262079936, 'leaf_estimation_iterations': 18, 'learning_rate': 0.028140912480619777, 'min_child_samples': 6, 'random_strength': 2}, duration=107.62
[I 2025-05-09 14:14:34,608] Trial 61 finished with value: 0.060036914529771855 and parameters: {'bagging_temperature': 0.3256431938214889, 'depth': 8, 'feature_border_type': 'MaxLogSum', 'grow_policy': 'Depthwise', 'l2_leaf_reg': 7.815714262079936, 'leaf_estimation_iterations': 18, 'learning_rate': 0.028140912480619777, 'min_child_samples': 6, 'random_strength': 2}. Best is trial 55 with value: 0.059823454946499696.
score=0.06002, best_iterations=[2291, 2713, 3149, 3039, 3079], params_gbdt={'bagging_temperature': 0.2763841474657537, 'depth': 9, 'feature_border_type': 'Median', 'grow_policy': 'Lossguide', 'l2_leaf_reg': 4.340953507529218, 'leaf_estimation_iterations': 1, 'learning_rate': 0.02544337182339603, 'min_child_samples': 3, 'random_strength': 2}, duration=167.99
