[I 2025-05-09 14:17:22,640] Trial 62 finished with value: 0.06001817086127203 and parameters: {'bagging_temperature': 0.2763841474657537, 'depth': 9, 'feature_border_type': 'Median', 'grow_policy': 'Lossguide', 'l2_leaf_reg': 4.340953507529218, 'leaf_estimation_iterations': 1, 'learning_rate': 0.02544337182339603, 'min_child_samples': 3, 'random_strength': 2}. Best is trial 55 with value: 0.059823454946499696.
score=0.05992, best_iterations=[922, 838, 891, 1113, 760], params_gbdt={'bagging_temperature': 0.3879030353849922, 'depth': 8, 'feature_border_type': 'MaxLogSum', 'grow_policy': 'Depthwise', 'l2_leaf_reg': 5.786504056277558, 'leaf_estimation_iterations': 2, 'learning_rate': 0.020800264703857884, 'min_child_samples': 6, 'random_strength': 4}, duration=91.31
[I 2025-05-09 14:18:54,016] Trial 63 finished with value: 0.059917629502424796 and parameters: {'bagging_temperature': 0.3879030353849922, 'depth': 8, 'feature_border_type': 'MaxLogSum', 'grow_policy': 'Depthwise', 'l2_leaf_reg': 5.786504056277558, 'leaf_estimation_iterations': 2, 'learning_rate': 0.020800264703857884, 'min_child_samples': 6, 'random_strength': 4}. Best is trial 55 with value: 0.059823454946499696.
score=0.05998, best_iterations=[489, 397, 385, 477, 358], params_gbdt={'bagging_temperature': 0.4977170903001913, 'depth': 8, 'feature_border_type': 'MaxLogSum', 'grow_policy': 'Depthwise', 'l2_leaf_reg': 8.202864915285613, 'leaf_estimation_iterations': 3, 'learning_rate': 0.05112189162393213, 'min_child_samples': 5, 'random_strength': 5}, duration=61.59
[I 2025-05-09 14:19:55,682] Trial 64 finished with value: 0.059978913845925075 and parameters: {'bagging_temperature': 0.4977170903001913, 'depth': 8, 'feature_border_type': 'MaxLogSum', 'grow_policy': 'Depthwise', 'l2_leaf_reg': 8.202864915285613, 'leaf_estimation_iterations': 3, 'learning_rate': 0.05112189162393213, 'min_child_samples': 5, 'random_strength': 5}. Best is trial 55 with value: 0.059823454946499696.
score=0.06007, best_iterations=[541, 863, 491, 800, 412], params_gbdt={'bagging_temperature': 0.5708042703533542, 'depth': 7, 'feature_border_type': 'MaxLogSum', 'grow_policy': 'Depthwise', 'l2_leaf_reg': 3.7617011685142194, 'leaf_estimation_iterations': 11, 'learning_rate': 0.039334869603410656, 'min_child_samples': 7, 'random_strength': 3}, duration=85.81
[I 2025-05-09 14:21:21,562] Trial 65 finished with value: 0.0600679987371063 and parameters: {'bagging_temperature': 0.5708042703533542, 'depth': 7, 'feature_border_type': 'MaxLogSum', 'grow_policy': 'Depthwise', 'l2_leaf_reg': 3.7617011685142194, 'leaf_estimation_iterations': 11, 'learning_rate': 0.039334869603410656, 'min_child_samples': 7, 'random_strength': 3}. Best is trial 55 with value: 0.059823454946499696.
score=0.05997, best_iterations=[1102, 1020, 940, 1191, 789], params_gbdt={'bagging_temperature': 0.33843044079060797, 'depth': 8, 'feature_border_type': 'GreedyLogSum', 'grow_policy': 'Depthwise', 'l2_leaf_reg': 5.0012973593925905, 'leaf_estimation_iterations': 4, 'learning_rate': 0.016505367138713607, 'min_child_samples': 6, 'random_strength': 12}, duration=111.66
[I 2025-05-09 14:23:13,286] Trial 66 finished with value: 0.05996694050008775 and parameters: {'bagging_temperature': 0.33843044079060797, 'depth': 8, 'feature_border_type': 'GreedyLogSum', 'grow_policy': 'Depthwise', 'l2_leaf_reg': 5.0012973593925905, 'leaf_estimation_iterations': 4, 'learning_rate': 0.016505367138713607, 'min_child_samples': 6, 'random_strength': 12}. Best is trial 55 with value: 0.059823454946499696.
score=0.05981, best_iterations=[3106, 3772, 2595, 3895, 2258], params_gbdt={'bagging_temperature': 0.44868262381819696, 'depth': 8, 'feature_border_type': 'MaxLogSum', 'grow_policy': 'Depthwise', 'l2_leaf_reg': 6.2524634202382385, 'leaf_estimation_iterations': 1, 'learning_rate': 0.007954295224317018, 'min_child_samples': 8, 'random_strength': 1}, duration=195.56
[I 2025-05-09 14:26:28,927] Trial 67 finished with value: 0.05980754724198882 and parameters: {'bagging_temperature': 0.44868262381819696, 'depth': 8, 'feature_border_type': 'MaxLogSum', 'grow_policy': 'Depthwise', 'l2_leaf_reg': 6.2524634202382385, 'leaf_estimation_iterations': 1, 'learning_rate': 0.007954295224317018, 'min_child_samples': 8, 'random_strength': 1}. Best is trial 67 with value: 0.05980754724198882.
score=0.05979, best_iterations=[4764, 5999, 5792, 5481, 4306], params_gbdt={'bagging_temperature': 0.4454899537186312, 'depth': 7, 'feature_border_type': 'MaxLogSum', 'grow_policy': 'Depthwise', 'l2_leaf_reg': 9.7663153673854, 'leaf_estimation_iterations': 1, 'learning_rate': 0.007826351303547748, 'min_child_samples': 5, 'random_strength': 1}, duration=244.11
[I 2025-05-09 14:30:33,117] Trial 68 finished with value: 0.05978688530848274 and parameters: {'bagging_temperature': 0.4454899537186312, 'depth': 7, 'feature_border_type': 'MaxLogSum', 'grow_policy': 'Depthwise', 'l2_leaf_reg': 9.7663153673854, 'leaf_estimation_iterations': 1, 'learning_rate': 0.007826351303547748, 'min_child_samples': 5, 'random_strength': 1}. Best is trial 68 with value: 0.05978688530848274.
score=0.05983, best_iterations=[5634, 5999, 5905, 5999, 5097], params_gbdt={'bagging_temperature': 0.4491832183900644, 'depth': 7, 'feature_border_type': 'MaxLogSum', 'grow_policy': 'Depthwise', 'l2_leaf_reg': 8.031199111781268, 'leaf_estimation_iterations': 1, 'learning_rate': 0.006489924128581378, 'min_child_samples': 4, 'random_strength': 1}, duration=267.75
[I 2025-05-09 14:35:00,944] Trial 69 finished with value: 0.05982806848752411 and parameters: {'bagging_temperature': 0.4491832183900644, 'depth': 7, 'feature_border_type': 'MaxLogSum', 'grow_policy': 'Depthwise', 'l2_leaf_reg': 8.031199111781268, 'leaf_estimation_iterations': 1, 'learning_rate': 0.006489924128581378, 'min_child_samples': 4, 'random_strength': 1}. Best is trial 68 with value: 0.05978688530848274.
score=0.06020, best_iterations=[5999, 5999, 5999, 5999, 5998], params_gbdt={'bagging_temperature': 0.6491898376036085, 'depth': 6, 'feature_border_type': 'MaxLogSum', 'grow_policy': 'Depthwise', 'l2_leaf_reg': 7.298680121195516, 'leaf_estimation_iterations': 1, 'learning_rate': 0.00477778683207262, 'min_child_samples': 3, 'random_strength': 1}, duration=242.10
[I 2025-05-09 14:39:03,115] Trial 70 finished with value: 0.060200880316533735 and parameters: {'bagging_temperature': 0.6491898376036085, 'depth': 6, 'feature_border_type': 'MaxLogSum', 'grow_policy': 'Depthwise', 'l2_leaf_reg': 7.298680121195516, 'leaf_estimation_iterations': 1, 'learning_rate': 0.00477778683207262, 'min_child_samples': 3, 'random_strength': 1}. Best is trial 68 with value: 0.05978688530848274.
score=0.06037, best_iterations=[5999, 5999, 5994, 5998, 5997], params_gbdt={'bagging_temperature': 0.44556779621172604, 'depth': 5, 'feature_border_type': 'MaxLogSum', 'grow_policy': 'Depthwise', 'l2_leaf_reg': 0.32615615542438303, 'leaf_estimation_iterations': 1, 'learning_rate': 0.006528710436269845, 'min_child_samples': 4, 'random_strength': 1}, duration=203.83
[I 2025-05-09 14:42:26,992] Trial 71 finished with value: 0.06036919183132656 and parameters: {'bagging_temperature': 0.44556779621172604, 'depth': 5, 'feature_border_type': 'MaxLogSum', 'grow_policy': 'Depthwise', 'l2_leaf_reg': 0.32615615542438303, 'leaf_estimation_iterations': 1, 'learning_rate': 0.006528710436269845, 'min_child_samples': 4, 'random_strength': 1}. Best is trial 68 with value: 0.05978688530848274.
score=0.05996, best_iterations=[3836, 4179, 3677, 3894, 3675], params_gbdt={'bagging_temperature': 0.5146242070582079, 'depth': 7, 'feature_border_type': 'Uniform', 'grow_policy': 'Depthwise', 'l2_leaf_reg': 2.6131402728845403, 'leaf_estimation_iterations': 3, 'learning_rate': 0.006020274708095656, 'min_child_samples': 4, 'random_strength': 2}, duration=248.39
[I 2025-05-09 14:46:35,454] Trial 72 finished with value: 0.05995502231041089 and parameters: {'bagging_temperature': 0.5146242070582079, 'depth': 7, 'feature_border_type': 'Uniform', 'grow_policy': 'Depthwise', 'l2_leaf_reg': 2.6131402728845403, 'leaf_estimation_iterations': 3, 'learning_rate': 0.006020274708095656, 'min_child_samples': 4, 'random_strength': 2}. Best is trial 68 with value: 0.05978688530848274.
score=0.05982, best_iterations=[5227, 4398, 4722, 5343, 4239], params_gbdt={'bagging_temperature': 0.8544862364761197, 'depth': 7, 'feature_border_type': 'MaxLogSum', 'grow_policy': 'Depthwise', 'l2_leaf_reg': 9.879396862367834, 'leaf_estimation_iterations': 1, 'learning_rate': 0.00852574705592549, 'min_child_samples': 5, 'random_strength': 1}, duration=227.29
[I 2025-05-09 14:50:22,816] Trial 73 finished with value: 0.05981797716260462 and parameters: {'bagging_temperature': 0.8544862364761197, 'depth': 7, 'feature_border_type': 'MaxLogSum', 'grow_policy': 'Depthwise', 'l2_leaf_reg': 9.879396862367834, 'leaf_estimation_iterations': 1, 'learning_rate': 0.00852574705592549, 'min_child_samples': 5, 'random_strength': 1}. Best is trial 68 with value: 0.05978688530848274.
score=0.05985, best_iterations=[4814, 4474, 3914, 4256, 3044], params_gbdt={'bagging_temperature': 0.9455842263587593, 'depth': 7, 'feature_border_type': 'MaxLogSum', 'grow_policy': 'Depthwise', 'l2_leaf_reg': 6.264943597382104, 'leaf_estimation_iterations': 1, 'learning_rate': 0.008357021923370936, 'min_child_samples': 5, 'random_strength': 1}, duration=203.49
[I 2025-05-09 14:53:46,377] Trial 74 finished with value: 0.05984942883837354 and parameters: {'bagging_temperature': 0.9455842263587593, 'depth': 7, 'feature_border_type': 'MaxLogSum', 'grow_policy': 'Depthwise', 'l2_leaf_reg': 6.264943597382104, 'leaf_estimation_iterations': 1, 'learning_rate': 0.008357021923370936, 'min_child_samples': 5, 'random_strength': 1}. Best is trial 68 with value: 0.05978688530848274.
score=0.05983, best_iterations=[5816, 5611, 5342, 5340, 4274], params_gbdt={'bagging_temperature': 0.8603920542830932, 'depth': 7, 'feature_border_type': 'MaxLogSum', 'grow_policy': 'Depthwise', 'l2_leaf_reg': 9.975087604064491, 'leaf_estimation_iterations': 1, 'learning_rate': 0.008021392880983521, 'min_child_samples': 4, 'random_strength': 1}, duration=245.00
[I 2025-05-09 14:57:51,428] Trial 75 finished with value: 0.05982514466347454 and parameters: {'bagging_temperature': 0.8603920542830932, 'depth': 7, 'feature_border_type': 'MaxLogSum', 'grow_policy': 'Depthwise', 'l2_leaf_reg': 9.975087604064491, 'leaf_estimation_iterations': 1, 'learning_rate': 0.008021392880983521, 'min_child_samples': 4, 'random_strength': 1}. Best is trial 68 with value: 0.05978688530848274.
score=0.05985, best_iterations=[4974, 5764, 3699, 4160, 3733], params_gbdt={'bagging_temperature': 0.8515904247897739, 'depth': 7, 'feature_border_type': 'MaxLogSum', 'grow_policy': 'Depthwise', 'l2_leaf_reg': 9.870128094785073, 'leaf_estimation_iterations': 1, 'learning_rate': 0.007890312103605024, 'min_child_samples': 4, 'random_strength': 1}, duration=214.97
[I 2025-05-09 15:01:26,474] Trial 76 finished with value: 0.059854344414567835 and parameters: {'bagging_temperature': 0.8515904247897739, 'depth': 7, 'feature_border_type': 'MaxLogSum', 'grow_policy': 'Depthwise', 'l2_leaf_reg': 9.870128094785073, 'leaf_estimation_iterations': 1, 'learning_rate': 0.007890312103605024, 'min_child_samples': 4, 'random_strength': 1}. Best is trial 68 with value: 0.05978688530848274.
score=0.05981, best_iterations=[5998, 4769, 4722, 5099, 4235], params_gbdt={'bagging_temperature': 0.8347770265423312, 'depth': 7, 'feature_border_type': 'MaxLogSum', 'grow_policy': 'Depthwise', 'l2_leaf_reg': 7.870257512532361, 'leaf_estimation_iterations': 1, 'learning_rate': 0.008042837915522284, 'min_child_samples': 4, 'random_strength': 1}, duration=236.62
[I 2025-05-09 15:05:23,172] Trial 77 finished with value: 0.059812388132397656 and parameters: {'bagging_temperature': 0.8347770265423312, 'depth': 7, 'feature_border_type': 'MaxLogSum', 'grow_policy': 'Depthwise', 'l2_leaf_reg': 7.870257512532361, 'leaf_estimation_iterations': 1, 'learning_rate': 0.008042837915522284, 'min_child_samples': 4, 'random_strength': 1}. Best is trial 68 with value: 0.05978688530848274.
score=0.05991, best_iterations=[5999, 5999, 5996, 5999, 5994], params_gbdt={'bagging_temperature': 0.936417615830831, 'depth': 6, 'feature_border_type': 'MaxLogSum', 'grow_policy': 'Depthwise', 'l2_leaf_reg': 7.92478109713668, 'leaf_estimation_iterations': 1, 'learning_rate': 0.008999358850446615, 'min_child_samples': 3, 'random_strength': 2}, duration=234.59
[I 2025-05-09 15:09:17,845] Trial 78 finished with value: 0.059910292917501745 and parameters: {'bagging_temperature': 0.936417615830831, 'depth': 6, 'feature_border_type': 'MaxLogSum', 'grow_policy': 'Depthwise', 'l2_leaf_reg': 7.92478109713668, 'leaf_estimation_iterations': 1, 'learning_rate': 0.008999358850446615, 'min_child_samples': 3, 'random_strength': 2}. Best is trial 68 with value: 0.05978688530848274.
score=0.06032, best_iterations=[5997, 5999, 5999, 5998, 5999], params_gbdt={'bagging_temperature': 0.7959891450100651, 'depth': 7, 'feature_border_type': 'MaxLogSum', 'grow_policy': 'Lossguide', 'l2_leaf_reg': 5.144867289133364, 'leaf_estimation_iterations': 3, 'learning_rate': 0.004993614695583121, 'min_child_samples': 4, 'random_strength': 2}, duration=373.04
[I 2025-05-09 15:15:30,960] Trial 79 finished with value: 0.06032432711235526 and parameters: {'bagging_temperature': 0.7959891450100651, 'depth': 7, 'feature_border_type': 'MaxLogSum', 'grow_policy': 'Lossguide', 'l2_leaf_reg': 5.144867289133364, 'leaf_estimation_iterations': 3, 'learning_rate': 0.004993614695583121, 'min_child_samples': 4, 'random_strength': 2}. Best is trial 68 with value: 0.05978688530848274.
score=0.05996, best_iterations=[5375, 5327, 4485, 3785, 3755], params_gbdt={'bagging_temperature': 0.8918514836950401, 'depth': 7, 'feature_border_type': 'MaxLogSum', 'grow_policy': 'Depthwise', 'l2_leaf_reg': 0.11401989062823166, 'leaf_estimation_iterations': 2, 'learning_rate': 0.004155410380615264, 'min_child_samples': 2, 'random_strength': 1}, duration=276.13
[I 2025-05-09 15:20:07,157] Trial 80 finished with value: 0.05995837345718721 and parameters: {'bagging_temperature': 0.8918514836950401, 'depth': 7, 'feature_border_type': 'MaxLogSum', 'grow_policy': 'Depthwise', 'l2_leaf_reg': 0.11401989062823166, 'leaf_estimation_iterations': 2, 'learning_rate': 0.004155410380615264, 'min_child_samples': 2, 'random_strength': 1}. Best is trial 68 with value: 0.05978688530848274.
score=0.05995, best_iterations=[3188, 3671, 2850, 2603, 2643], params_gbdt={'bagging_temperature': 0.8307701125781265, 'depth': 7, 'feature_border_type': 'MaxLogSum', 'grow_policy': 'Depthwise', 'l2_leaf_reg': 0.023502915409926182, 'leaf_estimation_iterations': 5, 'learning_rate': 0.006687925153231325, 'min_child_samples': 4, 'random_strength': 2}, duration=221.97
[I 2025-05-09 15:23:49,189] Trial 81 finished with value: 0.05994647470150625 and parameters: {'bagging_temperature': 0.8307701125781265, 'depth': 7, 'feature_border_type': 'MaxLogSum', 'grow_policy': 'Depthwise', 'l2_leaf_reg': 0.023502915409926182, 'leaf_estimation_iterations': 5, 'learning_rate': 0.006687925153231325, 'min_child_samples': 4, 'random_strength': 2}. Best is trial 68 with value: 0.05978688530848274.
score=0.05997, best_iterations=[5999, 5999, 5993, 5999, 4871], params_gbdt={'bagging_temperature': 0.908863920590173, 'depth': 6, 'feature_border_type': 'MaxLogSum', 'grow_policy': 'Depthwise', 'l2_leaf_reg': 6.276149287315314, 'leaf_estimation_iterations': 1, 'learning_rate': 0.00786056548702449, 'min_child_samples': 5, 'random_strength': 1}, duration=227.39
[I 2025-05-09 15:27:36,649] Trial 82 finished with value: 0.05997051396911707 and parameters: {'bagging_temperature': 0.908863920590173, 'depth': 6, 'feature_border_type': 'MaxLogSum', 'grow_policy': 'Depthwise', 'l2_leaf_reg': 6.276149287315314, 'leaf_estimation_iterations': 1, 'learning_rate': 0.00786056548702449, 'min_child_samples': 5, 'random_strength': 1}. Best is trial 68 with value: 0.05978688530848274.
score=0.05988, best_iterations=[5994, 4771, 3695, 4333, 3234], params_gbdt={'bagging_temperature': 0.8540932571991802, 'depth': 7, 'feature_border_type': 'MaxLogSum', 'grow_policy': 'Depthwise', 'l2_leaf_reg': 9.910241599775267, 'leaf_estimation_iterations': 1, 'learning_rate': 0.007675734092933243, 'min_child_samples': 4, 'random_strength': 1}, duration=218.94
[I 2025-05-09 15:31:15,634] Trial 83 finished with value: 0.05987651169079437 and parameters: {'bagging_temperature': 0.8540932571991802, 'depth': 7, 'feature_border_type': 'MaxLogSum', 'grow_policy': 'Depthwise', 'l2_leaf_reg': 9.910241599775267, 'leaf_estimation_iterations': 1, 'learning_rate': 0.007675734092933243, 'min_child_samples': 4, 'random_strength': 1}. Best is trial 68 with value: 0.05978688530848274.
score=0.05985, best_iterations=[3683, 4038, 3392, 3977, 2584], params_gbdt={'bagging_temperature': 0.8694400699869118, 'depth': 7, 'feature_border_type': 'MaxLogSum', 'grow_policy': 'Depthwise', 'l2_leaf_reg': 7.949766103776908, 'leaf_estimation_iterations': 2, 'learning_rate': 0.008583363311691, 'min_child_samples': 3, 'random_strength': 1}, duration=209.71
[I 2025-05-09 15:34:45,420] Trial 84 finished with value: 0.059846453073205276 and parameters: {'bagging_temperature': 0.8694400699869118, 'depth': 7, 'feature_border_type': 'MaxLogSum', 'grow_policy': 'Depthwise', 'l2_leaf_reg': 7.949766103776908, 'leaf_estimation_iterations': 2, 'learning_rate': 0.008583363311691, 'min_child_samples': 3, 'random_strength': 1}. Best is trial 68 with value: 0.05978688530848274.
score=0.05982, best_iterations=[3782, 4038, 3294, 3614, 2845], params_gbdt={'bagging_temperature': 0.7519460231367232, 'depth': 7, 'feature_border_type': 'MaxLogSum', 'grow_policy': 'Depthwise', 'l2_leaf_reg': 7.673972369038386, 'leaf_estimation_iterations': 2, 'learning_rate': 0.008701319844354854, 'min_child_samples': 3, 'random_strength': 2}, duration=209.10
[I 2025-05-09 15:38:14,565] Trial 85 finished with value: 0.05982499575157037 and parameters: {'bagging_temperature': 0.7519460231367232, 'depth': 7, 'feature_border_type': 'MaxLogSum', 'grow_policy': 'Depthwise', 'l2_leaf_reg': 7.673972369038386, 'leaf_estimation_iterations': 2, 'learning_rate': 0.008701319844354854, 'min_child_samples': 3, 'random_strength': 2}. Best is trial 68 with value: 0.05978688530848274.
score=0.05989, best_iterations=[4781, 5992, 5090, 5999, 4876], params_gbdt={'bagging_temperature': 0.7672682741546069, 'depth': 7, 'feature_border_type': 'Median', 'grow_policy': 'Depthwise', 'l2_leaf_reg': 7.993995999294951, 'leaf_estimation_iterations': 2, 'learning_rate': 0.005349535860559976, 'min_child_samples': 2, 'random_strength': 2}, duration=308.28
[I 2025-05-09 15:43:22,893] Trial 86 finished with value: 0.05989477481292952 and parameters: {'bagging_temperature': 0.7672682741546069, 'depth': 7, 'feature_border_type': 'Median', 'grow_policy': 'Depthwise', 'l2_leaf_reg': 7.993995999294951, 'leaf_estimation_iterations': 2, 'learning_rate': 0.005349535860559976, 'min_child_samples': 2, 'random_strength': 2}. Best is trial 68 with value: 0.05978688530848274.

Process finished with exit code -1
