C:\Users\Johannes\PycharmProjects\kaggle-calories_2025-5\.venv\Scripts\python.exe C:\Users\Johannes\PycharmProjects\kaggle-calories_2025-5\experiments\exp7_optuna_catboost_from_64.py
Competition Features: df_train.shape=(750000, 7), df_test.shape=(250000, 7)
After adding AutoFE: df_train.shape=(750000, 49), df_test.shape=(250000, 49)
df_train.shape=(750000, 49), df_test.shape=(250000, 49)
duration_loading_data='1'
[I 2025-05-09 11:45:37,440] Using an existing study with name 'exp7-study' instead of creating a new one.
score=0.05995, best_iterations=[837, 1073, 1109, 1421, 1051], params_gbdt={'bagging_temperature': 0.721526782847415, 'depth': 7, 'feature_border_type': 'Median', 'grow_policy': 'Depthwise', 'l2_leaf_reg': 2.9633443995105764, 'leaf_estimation_iterations': 2, 'learning_rate': 0.02834420158956284, 'min_child_samples': 7, 'random_strength': 6}, duration=121.48
[I 2025-05-09 11:47:39,028] Trial 8 finished with value: 0.05994957839176885 and parameters: {'bagging_temperature': 0.721526782847415, 'depth': 7, 'feature_border_type': 'Median', 'grow_policy': 'Depthwise', 'l2_leaf_reg': 2.9633443995105764, 'leaf_estimation_iterations': 2, 'learning_rate': 0.02834420158956284, 'min_child_samples': 7, 'random_strength': 6}. Best is trial 8 with value: 0.05994957839176885.
score=0.06010, best_iterations=[1244, 1442, 1687, 1371, 1326], params_gbdt={'bagging_temperature': 0.8734878468275283, 'depth': 6, 'feature_border_type': 'MinEntropy', 'grow_policy': 'Depthwise', 'l2_leaf_reg': 0.04200138081889505, 'leaf_estimation_iterations': 11, 'learning_rate': 0.026360436485618685, 'min_child_samples': 5, 'random_strength': 2}, duration=148.42
[I 2025-05-09 11:50:07,487] Trial 9 finished with value: 0.060099913590015035 and parameters: {'bagging_temperature': 0.8734878468275283, 'depth': 6, 'feature_border_type': 'MinEntropy', 'grow_policy': 'Depthwise', 'l2_leaf_reg': 0.04200138081889505, 'leaf_estimation_iterations': 11, 'learning_rate': 0.026360436485618685, 'min_child_samples': 5, 'random_strength': 2}. Best is trial 8 with value: 0.05994957839176885.
score=0.06024, best_iterations=[854, 1445, 1184, 1196, 1045], params_gbdt={'bagging_temperature': 0.34126437434636847, 'depth': 6, 'feature_border_type': 'Median', 'grow_policy': 'Depthwise', 'l2_leaf_reg': 0.8702434052036426, 'leaf_estimation_iterations': 10, 'learning_rate': 0.03354784521600051, 'min_child_samples': 1, 'random_strength': 5}, duration=127.11
[I 2025-05-09 11:52:14,667] Trial 10 finished with value: 0.06024053147938561 and parameters: {'bagging_temperature': 0.34126437434636847, 'depth': 6, 'feature_border_type': 'Median', 'grow_policy': 'Depthwise', 'l2_leaf_reg': 0.8702434052036426, 'leaf_estimation_iterations': 10, 'learning_rate': 0.03354784521600051, 'min_child_samples': 1, 'random_strength': 5}. Best is trial 8 with value: 0.05994957839176885.
score=0.06013, best_iterations=[1281, 1121, 940, 1277, 852], params_gbdt={'bagging_temperature': 0.6434108679968209, 'depth': 6, 'feature_border_type': 'Uniform', 'grow_policy': 'Depthwise', 'l2_leaf_reg': 7.547213263254223, 'leaf_estimation_iterations': 17, 'learning_rate': 0.04439665056197915, 'min_child_samples': 9, 'random_strength': 13}, duration=138.32
[I 2025-05-09 11:54:33,060] Trial 11 finished with value: 0.0601335345866161 and parameters: {'bagging_temperature': 0.6434108679968209, 'depth': 6, 'feature_border_type': 'Uniform', 'grow_policy': 'Depthwise', 'l2_leaf_reg': 7.547213263254223, 'leaf_estimation_iterations': 17, 'learning_rate': 0.04439665056197915, 'min_child_samples': 9, 'random_strength': 13}. Best is trial 8 with value: 0.05994957839176885.
score=0.06010, best_iterations=[1969, 1936, 1931, 1941, 2028], params_gbdt={'bagging_temperature': 0.7370696176078875, 'depth': 10, 'feature_border_type': 'Median', 'grow_policy': 'Depthwise', 'l2_leaf_reg': 1.3321404643812542, 'leaf_estimation_iterations': 1, 'learning_rate': 0.004590460206372178, 'min_child_samples': 10, 'random_strength': 7}, duration=280.86
[I 2025-05-09 11:59:13,999] Trial 12 finished with value: 0.06009842352567731 and parameters: {'bagging_temperature': 0.7370696176078875, 'depth': 10, 'feature_border_type': 'Median', 'grow_policy': 'Depthwise', 'l2_leaf_reg': 1.3321404643812542, 'leaf_estimation_iterations': 1, 'learning_rate': 0.004590460206372178, 'min_child_samples': 10, 'random_strength': 7}. Best is trial 8 with value: 0.05994957839176885.
score=0.05989, best_iterations=[2294, 2124, 1867, 1936, 1676], params_gbdt={'bagging_temperature': 0.7170837191414771, 'depth': 7, 'feature_border_type': 'UniformAndQuantiles', 'grow_policy': 'Depthwise', 'l2_leaf_reg': 9.421609098963179, 'leaf_estimation_iterations': 5, 'learning_rate': 0.014307365060264091, 'min_child_samples': 7, 'random_strength': 19}, duration=150.10
[I 2025-05-09 12:01:44,166] Trial 13 finished with value: 0.05988912554368595 and parameters: {'bagging_temperature': 0.7170837191414771, 'depth': 7, 'feature_border_type': 'UniformAndQuantiles', 'grow_policy': 'Depthwise', 'l2_leaf_reg': 9.421609098963179, 'leaf_estimation_iterations': 5, 'learning_rate': 0.014307365060264091, 'min_child_samples': 7, 'random_strength': 19}. Best is trial 13 with value: 0.05988912554368595.
score=0.05986, best_iterations=[1681, 1713, 1330, 1852, 1153], params_gbdt={'bagging_temperature': 0.7592891391932078, 'depth': 8, 'feature_border_type': 'UniformAndQuantiles', 'grow_policy': 'Depthwise', 'l2_leaf_reg': 2.532466776053784, 'leaf_estimation_iterations': 1, 'learning_rate': 0.012518715240052491, 'min_child_samples': 7, 'random_strength': 7}, duration=108.41
[I 2025-05-09 12:03:32,655] Trial 14 finished with value: 0.0598598500699203 and parameters: {'bagging_temperature': 0.7592891391932078, 'depth': 8, 'feature_border_type': 'UniformAndQuantiles', 'grow_policy': 'Depthwise', 'l2_leaf_reg': 2.532466776053784, 'leaf_estimation_iterations': 1, 'learning_rate': 0.012518715240052491, 'min_child_samples': 7, 'random_strength': 7}. Best is trial 14 with value: 0.0598598500699203.
score=0.05997, best_iterations=[1267, 1418, 1329, 1558, 1047], params_gbdt={'bagging_temperature': 0.8097747321773119, 'depth': 8, 'feature_border_type': 'UniformAndQuantiles', 'grow_policy': 'Depthwise', 'l2_leaf_reg': 1.9617230308479134, 'leaf_estimation_iterations': 7, 'learning_rate': 0.011399143534371273, 'min_child_samples': 7, 'random_strength': 20}, duration=147.60
[I 2025-05-09 12:06:00,299] Trial 15 finished with value: 0.05997193508645964 and parameters: {'bagging_temperature': 0.8097747321773119, 'depth': 8, 'feature_border_type': 'UniformAndQuantiles', 'grow_policy': 'Depthwise', 'l2_leaf_reg': 1.9617230308479134, 'leaf_estimation_iterations': 7, 'learning_rate': 0.011399143534371273, 'min_child_samples': 7, 'random_strength': 20}. Best is trial 14 with value: 0.0598598500699203.
score=0.06010, best_iterations=[928, 867, 866, 992, 906], params_gbdt={'bagging_temperature': 0.6054611588053678, 'depth': 10, 'feature_border_type': 'UniformAndQuantiles', 'grow_policy': 'Depthwise', 'l2_leaf_reg': 0.39943022948886536, 'leaf_estimation_iterations': 1, 'learning_rate': 0.009901137287990401, 'min_child_samples': 9, 'random_strength': 9}, duration=137.71
[I 2025-05-09 12:08:18,047] Trial 16 finished with value: 0.06009699109146103 and parameters: {'bagging_temperature': 0.6054611588053678, 'depth': 10, 'feature_border_type': 'UniformAndQuantiles', 'grow_policy': 'Depthwise', 'l2_leaf_reg': 0.39943022948886536, 'leaf_estimation_iterations': 1, 'learning_rate': 0.009901137287990401, 'min_child_samples': 9, 'random_strength': 9}. Best is trial 14 with value: 0.0598598500699203.
score=0.05995, best_iterations=[1813, 1597, 1616, 1235, 1323], params_gbdt={'bagging_temperature': 0.9732346408008716, 'depth': 7, 'feature_border_type': 'UniformAndQuantiles', 'grow_policy': 'Depthwise', 'l2_leaf_reg': 9.64225233332735, 'leaf_estimation_iterations': 9, 'learning_rate': 0.015128724191272607, 'min_child_samples': 6, 'random_strength': 15}, duration=143.42
[I 2025-05-09 12:10:41,531] Trial 17 finished with value: 0.05994881741667861 and parameters: {'bagging_temperature': 0.9732346408008716, 'depth': 7, 'feature_border_type': 'UniformAndQuantiles', 'grow_policy': 'Depthwise', 'l2_leaf_reg': 9.64225233332735, 'leaf_estimation_iterations': 9, 'learning_rate': 0.015128724191272607, 'min_child_samples': 6, 'random_strength': 15}. Best is trial 14 with value: 0.0598598500699203.
score=0.06003, best_iterations=[1598, 1561, 1505, 1784, 1668], params_gbdt={'bagging_temperature': 0.6767300790702111, 'depth': 9, 'feature_border_type': 'UniformAndQuantiles', 'grow_policy': 'Depthwise', 'l2_leaf_reg': 3.480040379698204, 'leaf_estimation_iterations': 14, 'learning_rate': 0.0059753115912988845, 'min_child_samples': 8, 'random_strength': 8}, duration=336.71
[I 2025-05-09 12:16:18,295] Trial 18 finished with value: 0.060028981831263054 and parameters: {'bagging_temperature': 0.6767300790702111, 'depth': 9, 'feature_border_type': 'UniformAndQuantiles', 'grow_policy': 'Depthwise', 'l2_leaf_reg': 3.480040379698204, 'leaf_estimation_iterations': 14, 'learning_rate': 0.0059753115912988845, 'min_child_samples': 8, 'random_strength': 8}. Best is trial 14 with value: 0.0598598500699203.
score=0.05999, best_iterations=[1559, 1448, 1822, 1890, 1398], params_gbdt={'bagging_temperature': 0.8279386320041696, 'depth': 7, 'feature_border_type': 'UniformAndQuantiles', 'grow_policy': 'Depthwise', 'l2_leaf_reg': 0.4747733673337323, 'leaf_estimation_iterations': 4, 'learning_rate': 0.014960788246249674, 'min_child_samples': 4, 'random_strength': 4}, duration=141.31
[I 2025-05-09 12:18:39,698] Trial 19 finished with value: 0.05999239913635393 and parameters: {'bagging_temperature': 0.8279386320041696, 'depth': 7, 'feature_border_type': 'UniformAndQuantiles', 'grow_policy': 'Depthwise', 'l2_leaf_reg': 0.4747733673337323, 'leaf_estimation_iterations': 4, 'learning_rate': 0.014960788246249674, 'min_child_samples': 4, 'random_strength': 4}. Best is trial 14 with value: 0.0598598500699203.
score=0.06033, best_iterations=[5999, 5999, 5999, 5999, 4954], params_gbdt={'bagging_temperature': 0.6070716011724632, 'depth': 8, 'feature_border_type': 'MaxLogSum', 'grow_policy': 'Lossguide', 'l2_leaf_reg': 0.08555924137047209, 'leaf_estimation_iterations': 8, 'learning_rate': 0.006063190703199909, 'min_child_samples': 5, 'random_strength': 15}, duration=458.89
[I 2025-05-09 12:26:18,646] Trial 20 finished with value: 0.06033222103003338 and parameters: {'bagging_temperature': 0.6070716011724632, 'depth': 8, 'feature_border_type': 'MaxLogSum', 'grow_policy': 'Lossguide', 'l2_leaf_reg': 0.08555924137047209, 'leaf_estimation_iterations': 8, 'learning_rate': 0.006063190703199909, 'min_child_samples': 5, 'random_strength': 15}. Best is trial 14 with value: 0.0598598500699203.
score=0.06041, best_iterations=[110, 96, 104, 106, 103], params_gbdt={'bagging_temperature': 0.772471407319909, 'depth': 9, 'feature_border_type': 'GreedyLogSum', 'grow_policy': 'Depthwise', 'l2_leaf_reg': 3.855588861644333, 'leaf_estimation_iterations': 20, 'learning_rate': 0.08247415215651294, 'min_child_samples': 6, 'random_strength': 9}, duration=54.29
[I 2025-05-09 12:27:12,997] Trial 21 finished with value: 0.060412674151118236 and parameters: {'bagging_temperature': 0.772471407319909, 'depth': 9, 'feature_border_type': 'GreedyLogSum', 'grow_policy': 'Depthwise', 'l2_leaf_reg': 3.855588861644333, 'leaf_estimation_iterations': 20, 'learning_rate': 0.08247415215651294, 'min_child_samples': 6, 'random_strength': 9}. Best is trial 14 with value: 0.0598598500699203.
score=0.06026, best_iterations=[3511, 3173, 3520, 3813, 2361], params_gbdt={'bagging_temperature': 0.9009267817815092, 'depth': 5, 'feature_border_type': 'UniformAndQuantiles', 'grow_policy': 'Depthwise', 'l2_leaf_reg': 1.351712449666414, 'leaf_estimation_iterations': 5, 'learning_rate': 0.016844892390828755, 'min_child_samples': 8, 'random_strength': 15}, duration=162.35
[I 2025-05-09 12:29:55,410] Trial 22 finished with value: 0.060262643829945256 and parameters: {'bagging_temperature': 0.9009267817815092, 'depth': 5, 'feature_border_type': 'UniformAndQuantiles', 'grow_policy': 'Depthwise', 'l2_leaf_reg': 1.351712449666414, 'leaf_estimation_iterations': 5, 'learning_rate': 0.016844892390828755, 'min_child_samples': 8, 'random_strength': 15}. Best is trial 14 with value: 0.0598598500699203.
score=0.05992, best_iterations=[1504, 1696, 1896, 2081, 1322], params_gbdt={'bagging_temperature': 0.9868712409635612, 'depth': 7, 'feature_border_type': 'UniformAndQuantiles', 'grow_policy': 'Depthwise', 'l2_leaf_reg': 8.884571284347729, 'leaf_estimation_iterations': 9, 'learning_rate': 0.014851959046765499, 'min_child_samples': 6, 'random_strength': 16}, duration=156.04
[I 2025-05-09 12:32:31,521] Trial 23 finished with value: 0.05991731970991887 and parameters: {'bagging_temperature': 0.9868712409635612, 'depth': 7, 'feature_border_type': 'UniformAndQuantiles', 'grow_policy': 'Depthwise', 'l2_leaf_reg': 8.884571284347729, 'leaf_estimation_iterations': 9, 'learning_rate': 0.014851959046765499, 'min_child_samples': 6, 'random_strength': 16}. Best is trial 14 with value: 0.0598598500699203.
score=0.05996, best_iterations=[1275, 1568, 1394, 1438, 1084], params_gbdt={'bagging_temperature': 0.9946013128409434, 'depth': 7, 'feature_border_type': 'UniformAndQuantiles', 'grow_policy': 'Depthwise', 'l2_leaf_reg': 4.891403551311386, 'leaf_estimation_iterations': 8, 'learning_rate': 0.0193394697566573, 'min_child_samples': 8, 'random_strength': 20}, duration=123.90
[I 2025-05-09 12:34:35,483] Trial 24 finished with value: 0.05995687170374354 and parameters: {'bagging_temperature': 0.9946013128409434, 'depth': 7, 'feature_border_type': 'UniformAndQuantiles', 'grow_policy': 'Depthwise', 'l2_leaf_reg': 4.891403551311386, 'leaf_estimation_iterations': 8, 'learning_rate': 0.0193394697566573, 'min_child_samples': 8, 'random_strength': 20}. Best is trial 14 with value: 0.0598598500699203.
score=0.05990, best_iterations=[3193, 3519, 2274, 3464, 2307], params_gbdt={'bagging_temperature': 0.5341286018696689, 'depth': 7, 'feature_border_type': 'UniformAndQuantiles', 'grow_policy': 'Depthwise', 'l2_leaf_reg': 2.247987648113226, 'leaf_estimation_iterations': 3, 'learning_rate': 0.008379707088229268, 'min_child_samples': 6, 'random_strength': 17}, duration=190.27
[I 2025-05-09 12:37:45,838] Trial 25 finished with value: 0.05989987031480813 and parameters: {'bagging_temperature': 0.5341286018696689, 'depth': 7, 'feature_border_type': 'UniformAndQuantiles', 'grow_policy': 'Depthwise', 'l2_leaf_reg': 2.247987648113226, 'leaf_estimation_iterations': 3, 'learning_rate': 0.008379707088229268, 'min_child_samples': 6, 'random_strength': 17}. Best is trial 14 with value: 0.0598598500699203.
score=0.05998, best_iterations=[2026, 1783, 1896, 2132, 1673], params_gbdt={'bagging_temperature': 0.5401885496697828, 'depth': 8, 'feature_border_type': 'UniformAndQuantiles', 'grow_policy': 'Depthwise', 'l2_leaf_reg': 0.7115363974104894, 'leaf_estimation_iterations': 3, 'learning_rate': 0.007035700342796621, 'min_child_samples': 4, 'random_strength': 18}, duration=173.20
[I 2025-05-09 12:40:39,115] Trial 26 finished with value: 0.05997736178854725 and parameters: {'bagging_temperature': 0.5401885496697828, 'depth': 8, 'feature_border_type': 'UniformAndQuantiles', 'grow_policy': 'Depthwise', 'l2_leaf_reg': 0.7115363974104894, 'leaf_estimation_iterations': 3, 'learning_rate': 0.007035700342796621, 'min_child_samples': 4, 'random_strength': 18}. Best is trial 14 with value: 0.0598598500699203.
score=0.06005, best_iterations=[1248, 1152, 1071, 1228, 1154], params_gbdt={'bagging_temperature': 0.540020651276339, 'depth': 9, 'feature_border_type': 'UniformAndQuantiles', 'grow_policy': 'Depthwise', 'l2_leaf_reg': 0.19615031663016302, 'leaf_estimation_iterations': 1, 'learning_rate': 0.008312930214739295, 'min_child_samples': 7, 'random_strength': 17}, duration=130.91
[I 2025-05-09 12:42:50,099] Trial 27 finished with value: 0.060053553128782446 and parameters: {'bagging_temperature': 0.540020651276339, 'depth': 9, 'feature_border_type': 'UniformAndQuantiles', 'grow_policy': 'Depthwise', 'l2_leaf_reg': 0.19615031663016302, 'leaf_estimation_iterations': 1, 'learning_rate': 0.008312930214739295, 'min_child_samples': 7, 'random_strength': 17}. Best is trial 14 with value: 0.0598598500699203.
score=0.06089, best_iterations=[5999, 5999, 5999, 5999, 5999], params_gbdt={'bagging_temperature': 0.6921909785126672, 'depth': 5, 'feature_border_type': 'UniformAndQuantiles', 'grow_policy': 'Lossguide', 'l2_leaf_reg': 2.2316584776808797, 'leaf_estimation_iterations': 3, 'learning_rate': 0.004139225203878439, 'min_child_samples': 5, 'random_strength': 20}, duration=329.28
[I 2025-05-09 12:48:19,436] Trial 28 finished with value: 0.06088603627252953 and parameters: {'bagging_temperature': 0.6921909785126672, 'depth': 5, 'feature_border_type': 'UniformAndQuantiles', 'grow_policy': 'Lossguide', 'l2_leaf_reg': 2.2316584776808797, 'leaf_estimation_iterations': 3, 'learning_rate': 0.004139225203878439, 'min_child_samples': 5, 'random_strength': 20}. Best is trial 14 with value: 0.0598598500699203.
score=0.05992, best_iterations=[2206, 1888, 2175, 1763, 1813], params_gbdt={'bagging_temperature': 0.59196472159536, 'depth': 7, 'feature_border_type': 'GreedyLogSum', 'grow_policy': 'Depthwise', 'l2_leaf_reg': 1.680152874068087, 'leaf_estimation_iterations': 5, 'learning_rate': 0.012094640770917068, 'min_child_samples': 9, 'random_strength': 10}, duration=149.62
[I 2025-05-09 12:50:49,100] Trial 29 finished with value: 0.05992230110677774 and parameters: {'bagging_temperature': 0.59196472159536, 'depth': 7, 'feature_border_type': 'GreedyLogSum', 'grow_policy': 'Depthwise', 'l2_leaf_reg': 1.680152874068087, 'leaf_estimation_iterations': 5, 'learning_rate': 0.012094640770917068, 'min_child_samples': 9, 'random_strength': 10}. Best is trial 14 with value: 0.0598598500699203.
score=0.05987, best_iterations=[2602, 1889, 2030, 1995, 1830], params_gbdt={'bagging_temperature': 0.3916357716203826, 'depth': 8, 'feature_border_type': 'MaxLogSum', 'grow_policy': 'Depthwise', 'l2_leaf_reg': 4.4987166417425435, 'leaf_estimation_iterations': 2, 'learning_rate': 0.007964691602553973, 'min_child_samples': 6, 'random_strength': 4}, duration=169.02
[I 2025-05-09 12:53:38,191] Trial 30 finished with value: 0.05987223787032886 and parameters: {'bagging_temperature': 0.3916357716203826, 'depth': 8, 'feature_border_type': 'MaxLogSum', 'grow_policy': 'Depthwise', 'l2_leaf_reg': 4.4987166417425435, 'leaf_estimation_iterations': 2, 'learning_rate': 0.007964691602553973, 'min_child_samples': 6, 'random_strength': 4}. Best is trial 14 with value: 0.0598598500699203.
score=0.06015, best_iterations=[3016, 2886, 2803, 3226, 1505], params_gbdt={'bagging_temperature': 0.29434460924144945, 'depth': 8, 'feature_border_type': 'MaxLogSum', 'grow_policy': 'Lossguide', 'l2_leaf_reg': 0.15863602324383586, 'leaf_estimation_iterations': 1, 'learning_rate': 0.021346279396180598, 'min_child_samples': 7, 'random_strength': 2}, duration=160.25
[I 2025-05-09 12:56:18,487] Trial 31 finished with value: 0.060154189812336084 and parameters: {'bagging_temperature': 0.29434460924144945, 'depth': 8, 'feature_border_type': 'MaxLogSum', 'grow_policy': 'Lossguide', 'l2_leaf_reg': 0.15863602324383586, 'leaf_estimation_iterations': 1, 'learning_rate': 0.021346279396180598, 'min_child_samples': 7, 'random_strength': 2}. Best is trial 14 with value: 0.0598598500699203.
score=0.06004, best_iterations=[1896, 1684, 1573, 1607, 1664], params_gbdt={'bagging_temperature': 0.18579422130212697, 'depth': 9, 'feature_border_type': 'MaxLogSum', 'grow_policy': 'Depthwise', 'l2_leaf_reg': 4.7427882336587075, 'leaf_estimation_iterations': 13, 'learning_rate': 0.005574995644874711, 'min_child_samples': 10, 'random_strength': 4}, duration=330.06
[I 2025-05-09 13:01:48,624] Trial 32 finished with value: 0.0600413398462077 and parameters: {'bagging_temperature': 0.18579422130212697, 'depth': 9, 'feature_border_type': 'MaxLogSum', 'grow_policy': 'Depthwise', 'l2_leaf_reg': 4.7427882336587075, 'leaf_estimation_iterations': 13, 'learning_rate': 0.005574995644874711, 'min_child_samples': 10, 'random_strength': 4}. Best is trial 14 with value: 0.0598598500699203.
score=0.05995, best_iterations=[2222, 1822, 1181, 2310, 1749], params_gbdt={'bagging_temperature': 0.32999570965928227, 'depth': 8, 'feature_border_type': 'MaxLogSum', 'grow_policy': 'Depthwise', 'l2_leaf_reg': 3.154194847303227, 'leaf_estimation_iterations': 3, 'learning_rate': 0.007305952038521535, 'min_child_samples': 6, 'random_strength': 1}, duration=172.27
[I 2025-05-09 13:04:40,971] Trial 33 finished with value: 0.059950845577266036 and parameters: {'bagging_temperature': 0.32999570965928227, 'depth': 8, 'feature_border_type': 'MaxLogSum', 'grow_policy': 'Depthwise', 'l2_leaf_reg': 3.154194847303227, 'leaf_estimation_iterations': 3, 'learning_rate': 0.007305952038521535, 'min_child_samples': 6, 'random_strength': 1}. Best is trial 14 with value: 0.0598598500699203.
score=0.05988, best_iterations=[2200, 2280, 2299, 2255, 1795], params_gbdt={'bagging_temperature': 0.4171359190157786, 'depth': 7, 'feature_border_type': 'MinEntropy', 'grow_policy': 'Depthwise', 'l2_leaf_reg': 6.106525246461352, 'leaf_estimation_iterations': 2, 'learning_rate': 0.011921641843414368, 'min_child_samples': 7, 'random_strength': 4}, duration=144.07
