C:\Users\Johannes\PycharmProjects\kaggle-calories_2025-5\.venv\Scripts\python.exe C:\Users\Johannes\PycharmProjects\kaggle-calories_2025-5\experiments\exp8_optuna_catboost_from_64_other_params.py
Competition Features: df_train.shape=(750000, 7), df_test.shape=(250000, 7)
After adding saved features: df_train.shape=(750000, 49), df_test.shape=(250000, 49)
df_train.shape=(750000, 49), df_test.shape=(250000, 49)
duration_loading_data='1'
[I 2025-05-09 23:12:27,394] Using an existing study with name 'exp8-study' instead of creating a new one.
score=0.11418, best_iterations=[1577, 1228, 627, 836, 1862], params_gbdt={'learning_rate': 0.1487968792573708, 'max_depth': 5, 'reg_lambda': 0.2774717764890143, 'max_bin': 18, 'random_strength': 8, 'feature_border_type': 'MaxLogSum', 'leaf_estimation_iterations': 17, 'leaf_estimation_method': 'Newton', 'grow_policy': 'SymmetricTree', 'bootstrap_type': 'MVS'}, duration=186.84
[I 2025-05-09 23:15:34,325] Trial 3 finished with value: 0.11418410773795563 and parameters: {'learning_rate': 0.1487968792573708, 'max_depth': 5, 'reg_lambda': 0.2774717764890143, 'max_bin': 18, 'random_strength': 8, 'feature_border_type': 'MaxLogSum', 'leaf_estimation_iterations': 17, 'leaf_estimation_method': 'Newton', 'grow_policy': 'SymmetricTree', 'bootstrap_type': 'MVS'}. Best is trial 0 with value: 0.05943875078820258.
score=0.06078, best_iterations=[583, 381, 421, 617, 397], params_gbdt={'learning_rate': 0.12916410858288552, 'max_depth': 11, 'reg_lambda': 0.6659648884669359, 'max_bin': 138, 'random_strength': 0, 'feature_border_type': 'MaxLogSum', 'leaf_estimation_iterations': 12, 'leaf_estimation_method': 'Gradient', 'grow_policy': 'Lossguide', 'bootstrap_type': 'No'}, duration=102.97
[I 2025-05-09 23:17:17,387] Trial 4 finished with value: 0.06078399689784059 and parameters: {'learning_rate': 0.12916410858288552, 'max_depth': 11, 'reg_lambda': 0.6659648884669359, 'max_bin': 138, 'random_strength': 0, 'feature_border_type': 'MaxLogSum', 'leaf_estimation_iterations': 12, 'leaf_estimation_method': 'Gradient', 'grow_policy': 'Lossguide', 'bootstrap_type': 'No'}. Best is trial 0 with value: 0.05943875078820258.
score=0.96279, best_iterations=[81, 205, 67, 80, 171], params_gbdt={'learning_rate': 0.03801202860008864, 'max_depth': 16, 'reg_lambda': 0.01372478954596947, 'max_bin': 31, 'random_strength': 0, 'feature_border_type': 'MinEntropy', 'leaf_estimation_iterations': 14, 'leaf_estimation_method': 'Newton', 'grow_policy': 'Lossguide', 'bootstrap_type': 'Poisson'}, duration=61.09
[I 2025-05-09 23:18:18,535] Trial 5 finished with value: 0.9627942343372635 and parameters: {'learning_rate': 0.03801202860008864, 'max_depth': 16, 'reg_lambda': 0.01372478954596947, 'max_bin': 31, 'random_strength': 0, 'feature_border_type': 'MinEntropy', 'leaf_estimation_iterations': 14, 'leaf_estimation_method': 'Newton', 'grow_policy': 'Lossguide', 'bootstrap_type': 'Poisson'}. Best is trial 0 with value: 0.05943875078820258.
score=0.33450, best_iterations=[3111, 3160, 3111, 3137, 3111], params_gbdt={'learning_rate': 0.03755664640140154, 'max_depth': 7, 'reg_lambda': 0.0023420492827849336, 'max_bin': 48, 'random_strength': 2, 'feature_border_type': 'MaxLogSum', 'leaf_estimation_iterations': 10, 'leaf_estimation_method': 'Newton', 'grow_policy': 'SymmetricTree', 'bootstrap_type': 'Poisson'}, duration=375.96
[I 2025-05-09 23:24:34,609] Trial 6 finished with value: 0.33449755270595893 and parameters: {'learning_rate': 0.03755664640140154, 'max_depth': 7, 'reg_lambda': 0.0023420492827849336, 'max_bin': 48, 'random_strength': 2, 'feature_border_type': 'MaxLogSum', 'leaf_estimation_iterations': 10, 'leaf_estimation_method': 'Newton', 'grow_policy': 'SymmetricTree', 'bootstrap_type': 'Poisson'}. Best is trial 0 with value: 0.05943875078820258.
score=0.06514, best_iterations=[85, 90, 88, 88, 85], params_gbdt={'learning_rate': 0.06944995641879481, 'max_depth': 16, 'reg_lambda': 0.034142411349800984, 'max_bin': 209, 'random_strength': 3, 'feature_border_type': 'UniformAndQuantiles', 'leaf_estimation_iterations': 8, 'leaf_estimation_method': 'Newton', 'grow_policy': 'Depthwise', 'bootstrap_type': 'Bayesian', 'bagging_temperature': 0.2119665825356694}, duration=777.45
[I 2025-05-09 23:37:32,168] Trial 7 finished with value: 0.06513668198594391 and parameters: {'learning_rate': 0.06944995641879481, 'max_depth': 16, 'reg_lambda': 0.034142411349800984, 'max_bin': 209, 'random_strength': 3, 'feature_border_type': 'UniformAndQuantiles', 'leaf_estimation_iterations': 8, 'leaf_estimation_method': 'Newton', 'grow_policy': 'Depthwise', 'bootstrap_type': 'Bayesian', 'bagging_temperature_type': 'float', 'bagging_temperature': 0.2119665825356694}. Best is trial 0 with value: 0.05943875078820258.
score=0.96323, best_iterations=[0, 0, 0, 0, 0], params_gbdt={'learning_rate': 0.1180723453636014, 'max_depth': 5, 'reg_lambda': 0.05622204116275438, 'max_bin': 47, 'random_strength': 4, 'feature_border_type': 'Uniform', 'leaf_estimation_iterations': 8, 'leaf_estimation_method': 'Gradient', 'grow_policy': 'Depthwise', 'bootstrap_type': 'Poisson'}, duration=35.99
[I 2025-05-09 23:38:08,220] Trial 8 finished with value: 0.963231795301748 and parameters: {'learning_rate': 0.1180723453636014, 'max_depth': 5, 'reg_lambda': 0.05622204116275438, 'max_bin': 47, 'random_strength': 4, 'feature_border_type': 'Uniform', 'leaf_estimation_iterations': 8, 'leaf_estimation_method': 'Gradient', 'grow_policy': 'Depthwise', 'bootstrap_type': 'Poisson'}. Best is trial 0 with value: 0.05943875078820258.
score=0.06120, best_iterations=[107, 108, 114, 108, 120], params_gbdt={'learning_rate': 0.07345330377257116, 'max_depth': 10, 'reg_lambda': 0.03279146555228468, 'max_bin': 27, 'random_strength': 0, 'feature_border_type': 'Median', 'leaf_estimation_iterations': 6, 'leaf_estimation_method': 'Gradient', 'grow_policy': 'Depthwise', 'bootstrap_type': 'Bayesian', 'bagging_temperature': 0.23291694157848905}, duration=56.40
[I 2025-05-09 23:39:04,673] Trial 9 finished with value: 0.06120380720943332 and parameters: {'learning_rate': 0.07345330377257116, 'max_depth': 10, 'reg_lambda': 0.03279146555228468, 'max_bin': 27, 'random_strength': 0, 'feature_border_type': 'Median', 'leaf_estimation_iterations': 6, 'leaf_estimation_method': 'Gradient', 'grow_policy': 'Depthwise', 'bootstrap_type': 'Bayesian', 'bagging_temperature_type': 'float', 'bagging_temperature': 0.23291694157848905}. Best is trial 0 with value: 0.05943875078820258.
score=0.05944, best_iterations=[797, 949, 1273, 1124, 1017], params_gbdt={'learning_rate': 0.038632549729719884, 'max_depth': 9, 'reg_lambda': 0.005009090175275747, 'max_bin': 196, 'random_strength': 6, 'feature_border_type': 'MaxLogSum', 'leaf_estimation_iterations': 20, 'leaf_estimation_method': 'Gradient', 'grow_policy': 'SymmetricTree', 'bootstrap_type': 'Bayesian', 'bagging_temperature': 0.1443791028999968}, duration=252.46
[I 2025-05-09 23:43:17,204] Trial 10 finished with value: 0.059443867000673 and parameters: {'learning_rate': 0.038632549729719884, 'max_depth': 9, 'reg_lambda': 0.005009090175275747, 'max_bin': 196, 'random_strength': 6, 'feature_border_type': 'MaxLogSum', 'leaf_estimation_iterations': 20, 'leaf_estimation_method': 'Gradient', 'grow_policy': 'SymmetricTree', 'bootstrap_type': 'Bayesian', 'bagging_temperature_type': 'float', 'bagging_temperature': 0.1443791028999968}. Best is trial 0 with value: 0.05943875078820258.
score=0.05946, best_iterations=[2215, 2276, 2016, 1951, 2066], params_gbdt={'learning_rate': 0.016882977414156963, 'max_depth': 12, 'reg_lambda': 9.6561730546319, 'max_bin': 153, 'random_strength': 6, 'feature_border_type': 'GreedyLogSum', 'leaf_estimation_iterations': 1, 'leaf_estimation_method': 'Gradient', 'grow_policy': 'SymmetricTree', 'bootstrap_type': 'No'}, duration=525.22
[I 2025-05-09 23:52:02,548] Trial 11 finished with value: 0.059459069146949275 and parameters: {'learning_rate': 0.016882977414156963, 'max_depth': 12, 'reg_lambda': 9.6561730546319, 'max_bin': 153, 'random_strength': 6, 'feature_border_type': 'GreedyLogSum', 'leaf_estimation_iterations': 1, 'leaf_estimation_method': 'Gradient', 'grow_policy': 'SymmetricTree', 'bootstrap_type': 'No'}. Best is trial 0 with value: 0.05943875078820258.
score=0.05939, best_iterations=[1880, 1714, 2245, 2253, 2228], params_gbdt={'learning_rate': 0.021703589745295113, 'max_depth': 8, 'reg_lambda': 0.001439155010518844, 'max_bin': 184, 'random_strength': 6, 'feature_border_type': 'MinEntropy', 'leaf_estimation_iterations': 20, 'leaf_estimation_method': 'Gradient', 'grow_policy': 'SymmetricTree', 'bootstrap_type': 'Bernoulli'}, duration=357.63
[I 2025-05-09 23:58:00,245] Trial 12 finished with value: 0.05938699738953617 and parameters: {'learning_rate': 0.021703589745295113, 'max_depth': 8, 'reg_lambda': 0.001439155010518844, 'max_bin': 184, 'random_strength': 6, 'feature_border_type': 'MinEntropy', 'leaf_estimation_iterations': 20, 'leaf_estimation_method': 'Gradient', 'grow_policy': 'SymmetricTree', 'bootstrap_type': 'Bernoulli'}. Best is trial 12 with value: 0.05938699738953617.
score=0.05944, best_iterations=[2011, 2241, 2483, 2491, 2075], params_gbdt={'learning_rate': 0.018679751508447, 'max_depth': 8, 'reg_lambda': 0.001045364961730629, 'max_bin': 254, 'random_strength': 10, 'feature_border_type': 'MinEntropy', 'leaf_estimation_iterations': 20, 'leaf_estimation_method': 'Gradient', 'grow_policy': 'SymmetricTree', 'bootstrap_type': 'Bernoulli'}, duration=393.74
[I 2025-05-10 00:04:34,050] Trial 13 finished with value: 0.05943787250828874 and parameters: {'learning_rate': 0.018679751508447, 'max_depth': 8, 'reg_lambda': 0.001045364961730629, 'max_bin': 254, 'random_strength': 10, 'feature_border_type': 'MinEntropy', 'leaf_estimation_iterations': 20, 'leaf_estimation_method': 'Gradient', 'grow_policy': 'SymmetricTree', 'bootstrap_type': 'Bernoulli'}. Best is trial 12 with value: 0.05938699738953617.
score=0.05947, best_iterations=[2623, 3095, 3504, 3770, 2346], params_gbdt={'learning_rate': 0.015773383510896147, 'max_depth': 7, 'reg_lambda': 0.0012846618040224613, 'max_bin': 247, 'random_strength': 10, 'feature_border_type': 'MinEntropy', 'leaf_estimation_iterations': 20, 'leaf_estimation_method': 'Gradient', 'grow_policy': 'SymmetricTree', 'bootstrap_type': 'Bernoulli'}, duration=422.09
[I 2025-05-10 00:11:36,205] Trial 14 finished with value: 0.059467248485016694 and parameters: {'learning_rate': 0.015773383510896147, 'max_depth': 7, 'reg_lambda': 0.0012846618040224613, 'max_bin': 247, 'random_strength': 10, 'feature_border_type': 'MinEntropy', 'leaf_estimation_iterations': 20, 'leaf_estimation_method': 'Gradient', 'grow_policy': 'SymmetricTree', 'bootstrap_type': 'Bernoulli'}. Best is trial 12 with value: 0.05938699738953617.
score=0.05945, best_iterations=[2244, 2066, 3269, 2214, 2359], params_gbdt={'learning_rate': 0.023267787861887063, 'max_depth': 7, 'reg_lambda': 0.006263459288131305, 'max_bin': 166, 'random_strength': 10, 'feature_border_type': 'MinEntropy', 'leaf_estimation_iterations': 16, 'leaf_estimation_method': 'Gradient', 'grow_policy': 'SymmetricTree', 'bootstrap_type': 'Bernoulli'}, duration=319.20
[I 2025-05-10 00:16:55,450] Trial 15 finished with value: 0.059450460450510265 and parameters: {'learning_rate': 0.023267787861887063, 'max_depth': 7, 'reg_lambda': 0.006263459288131305, 'max_bin': 166, 'random_strength': 10, 'feature_border_type': 'MinEntropy', 'leaf_estimation_iterations': 16, 'leaf_estimation_method': 'Gradient', 'grow_policy': 'SymmetricTree', 'bootstrap_type': 'Bernoulli'}. Best is trial 12 with value: 0.05938699738953617.
score=0.05944, best_iterations=[2704, 2911, 3635, 3246, 3197], params_gbdt={'learning_rate': 0.012235487422138161, 'max_depth': 8, 'reg_lambda': 0.0011336947144868716, 'max_bin': 92, 'random_strength': 8, 'feature_border_type': 'MinEntropy', 'leaf_estimation_iterations': 20, 'leaf_estimation_method': 'Gradient', 'grow_policy': 'SymmetricTree', 'bootstrap_type': 'Bernoulli'}, duration=519.35
[I 2025-05-10 00:25:34,876] Trial 16 finished with value: 0.05943630821966449 and parameters: {'learning_rate': 0.012235487422138161, 'max_depth': 8, 'reg_lambda': 0.0011336947144868716, 'max_bin': 92, 'random_strength': 8, 'feature_border_type': 'MinEntropy', 'leaf_estimation_iterations': 20, 'leaf_estimation_method': 'Gradient', 'grow_policy': 'SymmetricTree', 'bootstrap_type': 'Bernoulli'}. Best is trial 12 with value: 0.05938699738953617.
score=0.05948, best_iterations=[2426, 2034, 2497, 2647, 1920], params_gbdt={'learning_rate': 0.011198561510580997, 'max_depth': 12, 'reg_lambda': 0.004070039243426372, 'max_bin': 94, 'random_strength': 8, 'feature_border_type': 'GreedyLogSum', 'leaf_estimation_iterations': 14, 'leaf_estimation_method': 'Gradient', 'grow_policy': 'SymmetricTree', 'bootstrap_type': 'Bernoulli'}, duration=1370.38
[I 2025-05-10 00:48:25,378] Trial 17 finished with value: 0.05948090527830444 and parameters: {'learning_rate': 0.011198561510580997, 'max_depth': 12, 'reg_lambda': 0.004070039243426372, 'max_bin': 94, 'random_strength': 8, 'feature_border_type': 'GreedyLogSum', 'leaf_estimation_iterations': 14, 'leaf_estimation_method': 'Gradient', 'grow_policy': 'SymmetricTree', 'bootstrap_type': 'Bernoulli'}. Best is trial 12 with value: 0.05938699738953617.
score=0.06007, best_iterations=[5999, 5999, 5998, 5992, 5999], params_gbdt={'learning_rate': 0.010511283241341582, 'max_depth': 4, 'reg_lambda': 0.014013491598365686, 'max_bin': 98, 'random_strength': 7, 'feature_border_type': 'Uniform', 'leaf_estimation_iterations': 18, 'leaf_estimation_method': 'Gradient', 'grow_policy': 'SymmetricTree', 'bootstrap_type': 'Bernoulli'}, duration=476.67
[I 2025-05-10 00:56:22,146] Trial 18 finished with value: 0.060067856819319976 and parameters: {'learning_rate': 0.010511283241341582, 'max_depth': 4, 'reg_lambda': 0.014013491598365686, 'max_bin': 98, 'random_strength': 7, 'feature_border_type': 'Uniform', 'leaf_estimation_iterations': 18, 'leaf_estimation_method': 'Gradient', 'grow_policy': 'SymmetricTree', 'bootstrap_type': 'Bernoulli'}. Best is trial 12 with value: 0.05938699738953617.

Process finished with exit code -1073741819 (0xC0000005)
